{
	"records": [
		{
			"domainName": "psychedelik.com",
			"domainType": "added",
			"createdDateISO8601": "2002-06-14T09:56:54+00:00",
			"updatedDateISO8601": "2021-12-07T10:03:56+00:00",
			"expiresDateISO8601": "2023-06-14T09:56:54+00:00",
			"createdDateRaw": "2002-06-14 09:56:54 UTC",
			"updatedDateRaw": "2021-12-07 10:03:56 UTC",
			"expiresDateRaw": "2023-06-14 09:56:54 UTC",
			"audit": {
				"createdDate": "2022-01-05T18:57:49+00:00",
				"updatedDate": "2022-01-05T18:57:49+00:00"
			},
			"nameServers": [
				"NS-102-C.GANDI.NET",
				"NS-108-B.GANDI.NET",
				"NS-2-A.GANDI.NET"
			],
			"whoisServer": "whois.gandi.net",
			"registrarName": "Gandi SAS",
			"status": [
				"clientTransferProhibited"
			],
			"cleanText": "Domain Name: psychedelik.com\nRegistrar WHOIS Server: whois.gandi.net\nRegistrar URL: http://www.gandi.net\nUpdated Date: 2021-12-08T09:38:23Z\nCreation Date: 2002-06-14T09:56:54Z\nRegistrar Registration Expiration Date: 2023-06-14T09:56:54Z\nRegistrar: GANDI SAS\nRegistrar IANA ID: 81\nRegistrar Abuse Contact Email: abuse@support.gandi.net\nRegistrar Abuse Contact Phone: +33.170377661\nDomain Status: clientTransferProhibited http://www.icann.org/epp#clientTransferProhibited\nRegistrant Name: REDACTED FOR PRIVACY\nRegistrant Street: REDACTED FOR PRIVACY\nRegistrant City: REDACTED FOR PRIVACY\nRegistrant State/Province: Bretagne\nRegistrant Postal Code: REDACTED FOR PRIVACY\nRegistrant Country: FR\nRegistrant Phone: REDACTED FOR PRIVACY\nRegistrant Fax: REDACTED FOR PRIVACY\nRegistrant Email: 69fc5adc7734bf7419dc6d1d3b7d4914-32532282@contact.gandi.net\nAdmin Name: REDACTED FOR PRIVACY\nAdmin Organization: REDACTED FOR PRIVACY\nAdmin Street: REDACTED FOR PRIVACY\nAdmin City: REDACTED FOR PRIVACY\nAdmin State/Province: REDACTED FOR PRIVACY\nAdmin Postal Code: REDACTED FOR PRIVACY\nAdmin Country: REDACTED FOR PRIVACY\nAdmin Phone: REDACTED FOR PRIVACY\nAdmin Fax: REDACTED FOR PRIVACY\nAdmin Email: f49d30ced9c22a9be906074be2f244a1-32532210@contact.gandi.net\nTech Name: REDACTED FOR PRIVACY\nTech Organization: REDACTED FOR PRIVACY\nTech Street: REDACTED FOR PRIVACY\nTech City: REDACTED FOR PRIVACY\nTech State/Province: REDACTED FOR PRIVACY\nTech Postal Code: REDACTED FOR PRIVACY\nTech Country: REDACTED FOR PRIVACY\nTech Phone: REDACTED FOR PRIVACY\nTech Fax: REDACTED FOR PRIVACY\nTech Email: aef748ca80d4a4f8a8dccac87a28b122-32532216@contact.gandi.net\nName Server: NS-2-A.GANDI.NET\nName Server: NS-108-B.GANDI.NET\nName Server: NS-102-C.GANDI.NET\n",
			"rawText": "Domain Name: psychedelik.com\nRegistry Domain ID: 87535220_DOMAIN_COM-VRSN\nRegistrar WHOIS Server: whois.gandi.net\nRegistrar URL: http://www.gandi.net\nUpdated Date: 2021-12-08T09:38:23Z\nCreation Date: 2002-06-14T09:56:54Z\nRegistrar Registration Expiration Date: 2023-06-14T09:56:54Z\nRegistrar: GANDI SAS\nRegistrar IANA ID: 81\nRegistrar Abuse Contact Email: abuse@support.gandi.net\nRegistrar Abuse Contact Phone: +33.170377661\nReseller: \nDomain Status: clientTransferProhibited http://www.icann.org/epp#clientTransferProhibited\nDomain Status: \nDomain Status: \nDomain Status: \nDomain Status: \nRegistry Registrant ID: REDACTED FOR PRIVACY\nRegistrant Name: REDACTED FOR PRIVACY\nRegistrant Organization: \nRegistrant Street: REDACTED FOR PRIVACY\nRegistrant City: REDACTED FOR PRIVACY\nRegistrant State/Province: Bretagne\nRegistrant Postal Code: REDACTED FOR PRIVACY\nRegistrant Country: FR\nRegistrant Phone: REDACTED FOR PRIVACY\nRegistrant Phone Ext:\nRegistrant Fax: REDACTED FOR PRIVACY\nRegistrant Fax Ext:\nRegistrant Email: 69fc5adc7734bf7419dc6d1d3b7d4914-32532282@contact.gandi.net\nRegistry Admin ID: REDACTED FOR PRIVACY\nAdmin Name: REDACTED FOR PRIVACY\nAdmin Organization: REDACTED FOR PRIVACY\nAdmin Street: REDACTED FOR PRIVACY\nAdmin City: REDACTED FOR PRIVACY\nAdmin State/Province: REDACTED FOR PRIVACY\nAdmin Postal Code: REDACTED FOR PRIVACY\nAdmin Country: REDACTED FOR PRIVACY\nAdmin Phone: REDACTED FOR PRIVACY\nAdmin Phone Ext:\nAdmin Fax: REDACTED FOR PRIVACY\nAdmin Fax Ext:\nAdmin Email: f49d30ced9c22a9be906074be2f244a1-32532210@contact.gandi.net\nRegistry Tech ID: REDACTED FOR PRIVACY\nTech Name: REDACTED FOR PRIVACY\nTech Organization: REDACTED FOR PRIVACY\nTech Street: REDACTED FOR PRIVACY\nTech City: REDACTED FOR PRIVACY\nTech State/Province: REDACTED FOR PRIVACY\nTech Postal Code: REDACTED FOR PRIVACY\nTech Country: REDACTED FOR PRIVACY\nTech Phone: REDACTED FOR PRIVACY\nTech Phone Ext:\nTech Fax: REDACTED FOR PRIVACY\nTech Fax Ext:\nTech Email: aef748ca80d4a4f8a8dccac87a28b122-32532216@contact.gandi.net\nName Server: NS-2-A.GANDI.NET\nName Server: NS-108-B.GANDI.NET\nName Server: NS-102-C.GANDI.NET\nName Server: \nName Server: \nName Server: \nName Server: \nName Server: \nName Server: \nName Server: \nDNSSEC: Unsigned\nURL of the ICANN WHOIS Data Problem Reporting System: http://wdprs.internic.net/\n>>> Last update of WHOIS database: 2022-01-05T18:57:48Z <<<\n\nFor more information on Whois status codes, please visit\nhttps://www.icann.org/epp\n\nReseller Email: \nReseller URL: \n\nPersonal data access and use are governed by French law, any use for the purpose of unsolicited mass commercial advertising as well as any mass or automated inquiries (for any intent other than the registration or modification of a domain name) are strictly forbidden. Copy of whole or part of our database without Gandi's endorsement is strictly forbidden.\nA dispute over the ownership of a domain name may be subject to the alternate procedure established by the Registry in question or brought before the courts.\nFor additional information, please contact us via the following form:\n https://www.gandi.net/support/contacter/mail/",
			"registrantContact": {
				"name": "REDACTED FOR PRIVACY",
				"organization": null,
				"street": "REDACTED FOR PRIVACY",
				"city": "REDACTED FOR PRIVACY",
				"state": "Bretagne",
				"postalCode": "REDACTED FOR PRIVACY",
				"country": "FRANCE",
				"email": "69fc5adc7734bf7419dc6d1d3b7d4914-32532282@contact.gandi.net",
				"telephone": "",
				"telephoneExt": null,
				"fax": "",
				"faxExt": null,
				"rawText": "Registrant Name: REDACTED FOR PRIVACY\nRegistrant Street: REDACTED FOR PRIVACY\nRegistrant City: REDACTED FOR PRIVACY\nRegistrant State/Province: Bretagne\nRegistrant Postal Code: REDACTED FOR PRIVACY\nRegistrant Country: FR\nRegistrant Phone: REDACTED FOR PRIVACY\nRegistrant Fax: REDACTED FOR PRIVACY\nRegistrant Email: 69fc5adc7734bf7419dc6d1d3b7d4914-32532282@contact.gandi.net"
			},
			"administrativeContact": {
				"name": "REDACTED FOR PRIVACY",
				"organization": "REDACTED FOR PRIVACY",
				"street": "REDACTED FOR PRIVACY",
				"city": "REDACTED FOR PRIVACY",
				"state": "REDACTED FOR PRIVACY",
				"postalCode": "REDACTED FOR PRIVACY",
				"country": "REDACTED FOR PRIVACY",
				"email": "f49d30ced9c22a9be906074be2f244a1-32532210@contact.gandi.net",
				"telephone": null,
				"telephoneExt": null,
				"fax": "",
				"faxExt": null,
				"rawText": "Admin Name: REDACTED FOR PRIVACY\nAdmin Organization: REDACTED FOR PRIVACY\nAdmin Street: REDACTED FOR PRIVACY\nAdmin City: REDACTED FOR PRIVACY\nAdmin State/Province: REDACTED FOR PRIVACY\nAdmin Postal Code: REDACTED FOR PRIVACY\nAdmin Country: REDACTED FOR PRIVACY\nAdmin Phone: REDACTED FOR PRIVACY\nAdmin Fax: REDACTED FOR PRIVACY\nAdmin Email: f49d30ced9c22a9be906074be2f244a1-32532210@contact.gandi.net"
			},
			"technicalContact": {
				"name": "REDACTED FOR PRIVACY",
				"organization": "REDACTED FOR PRIVACY",
				"street": "REDACTED FOR PRIVACY",
				"city": "REDACTED FOR PRIVACY",
				"state": "REDACTED FOR PRIVACY",
				"postalCode": "REDACTED FOR PRIVACY",
				"country": "REDACTED FOR PRIVACY",
				"email": "aef748ca80d4a4f8a8dccac87a28b122-32532216@contact.gandi.net",
				"telephone": null,
				"telephoneExt": null,
				"fax": "",
				"faxExt": null,
				"rawText": "Tech Name: REDACTED FOR PRIVACY\nTech Organization: REDACTED FOR PRIVACY\nTech Street: REDACTED FOR PRIVACY\nTech City: REDACTED FOR PRIVACY\nTech State/Province: REDACTED FOR PRIVACY\nTech Postal Code: REDACTED FOR PRIVACY\nTech Country: REDACTED FOR PRIVACY\nTech Phone: REDACTED FOR PRIVACY\nTech Fax: REDACTED FOR PRIVACY\nTech Email: aef748ca80d4a4f8a8dccac87a28b122-32532216@contact.gandi.net"
			},
			"billingContact": {
				"name": null,
				"organization": null,
				"street": "",
				"city": null,
				"state": null,
				"postalCode": null,
				"country": null,
				"email": null,
				"telephone": null,
				"telephoneExt": null,
				"fax": null,
				"faxExt": null,
				"rawText": ""
			},
			"zoneContact": {
				"name": null,
				"organization": null,
				"street": "",
				"city": null,
				"state": null,
				"postalCode": null,
				"country": null,
				"email": null,
				"telephone": null,
				"telephoneExt": null,
				"fax": null,
				"faxExt": null,
				"rawText": ""
			}
		},
		{
			"domainName": "psychedelik.com",
			"domainType": "added",
			"createdDateISO8601": "2002-06-14T09:56:54+00:00",
			"updatedDateISO8601": "2021-12-08T09:38:23+00:00",
			"expiresDateISO8601": "2023-06-14T09:56:54+00:00",
			"createdDateRaw": "2002-06-14T09:56:54Z",
			"updatedDateRaw": "2021-12-08T09:38:23Z",
			"expiresDateRaw": "2023-06-14T09:56:54Z",
			"audit": {
				"createdDate": "2021-12-09T11:30:08+00:00",
				"updatedDate": "2021-12-09T11:30:08+00:00"
			},
			"nameServers": [
				"NS-2-A.GANDI.NET|NS-108-B.GANDI.NET|NS-102-C.GANDI.NET|"
			],
			"whoisServer": "whois.gandi.net",
			"registrarName": "GANDI SAS",
			"status": [
				"clientTransferProhibited"
			],
			"cleanText": "Domain Name: PSYCHEDELIK.COM|   Registry Domain ID: 87535220_DOMAIN_COM-VRSN|   Registrar WHOIS Server: whois.gandi.net|   Registrar URL: http://www.gandi.net|   Updated Date: 2021-12-07T10:03:56Z|   Creation Date: 2002-06-14T09:56:54Z|   Registry Expiry Date: 2023-06-14T09:56:54Z|   Registrar: Gandi SAS|   Registrar IANA ID: 81|   Registrar Abuse Contact Email: abuse@support.gandi.net|   Registrar Abuse Contact Phone: +33.170377661|   Domain Status: clientTransferProhibited https://icann.org/epp#clientTransferProhibited|   Name Server: NS-102-C.GANDI.NET|   Name Server: NS-108-B.GANDI.NET|   Name Server: NS-2-A.GANDI.NET|   DNSSEC: unsigned|   URL of the ICANN Whois Inaccuracy Complaint Form: https://www.icann.org/wicf/|>>> Last update of whois database: 2021-12-09T07:56:21Z <<<||For more information on Whois status codes, please visit https://icann.org/epp||NOTICE: The expiration date displayed in this record is the date the|registrar's sponsorship of the domain name registration in the registry is|currently set to expire. This date does not necessarily reflect the expiration|date of the domain name registrant's agreement with the sponsoring|registrar.  Users may consult the sponsoring registrar's Whois database to|view the registrar's reported date of expiration for this registration.||TERMS OF USE: You are not authorized to access or query our Whois|database through the use of electronic processes that are high-volume and|automated except as reasonably necessary to register domain names or|modify existing registrations; the Data in VeriSign Global Registry|Services' (\"VeriSign\") Whois database is provided by VeriSign for|information purposes only, and to assist persons in obtaining information|about or related to a domain name registration record. VeriSign does not|guarantee its accuracy. By submitting a Whois query, you agree to abide|by the following terms of use: You agree that you may use this Data only|for lawful purposes and that under no circumstances will you use this Data|to: (1) allow, enable, or otherwise support the transmission of mass|unsolicited, commercial advertising or solicitations via e-mail, telephone,|or facsimile; or (2) enable high volume, automated, electronic processes|that apply to VeriSign (or its computer systems). The compilation,|repackaging, dissemination or other use of this Data is expressly|prohibited without the prior written consent of VeriSign. You agree not to|use electronic processes that are automated and high-volume to access or|query the Whois database except as reasonably necessary to register|domain names or modify existing registrations. VeriSign reserves the right|to restrict your access to the Whois database in its sole discretion to ensure|operational stability.  VeriSign may restrict or terminate your access to the|Whois database for failure to abide by these terms of use. VeriSign|reserves the right to modify these terms at any time.||The Registry database contains ONLY .COM, .NET, .EDU domains and|Registrars.",
			"rawText": "Domain Name: psychedelik.com|Registry Domain ID: 87535220_DOMAIN_COM-VRSN|Registrar WHOIS Server: whois.gandi.net|Registrar URL: http://www.gandi.net|Updated Date: 2021-12-08T09:38:23Z|Creation Date: 2002-06-14T09:56:54Z|Registrar Registration Expiration Date: 2023-06-14T09:56:54Z|Registrar: GANDI SAS|Registrar IANA ID: 81|Registrar Abuse Contact Email: abuse@support.gandi.net|Registrar Abuse Contact Phone: +33.170377661|Reseller: |Domain Status: clientTransferProhibited http://www.icann.org/epp#clientTransferProhibited|Domain Status: |Domain Status: |Domain Status: |Domain Status: |Registry Registrant ID: REDACTED FOR PRIVACY|Registrant Name: REDACTED FOR PRIVACY|Registrant Organization: |Registrant Street: REDACTED FOR PRIVACY|Registrant City: REDACTED FOR PRIVACY|Registrant State/Province: Bretagne|Registrant Postal Code: REDACTED FOR PRIVACY|Registrant Country: FR|Registrant Phone: REDACTED FOR PRIVACY|Registrant Phone Ext:|Registrant Fax: REDACTED FOR PRIVACY|Registrant Fax Ext:|Registrant Email: 69fc5adc7734bf7419dc6d1d3b7d4914-32532282@contact.gandi.net|Registry Admin ID: REDACTED FOR PRIVACY|Admin Name: REDACTED FOR PRIVACY|Admin Organization: REDACTED FOR PRIVACY|Admin Street: REDACTED FOR PRIVACY|Admin City: REDACTED FOR PRIVACY|Admin State/Province: REDACTED FOR PRIVACY|Admin Postal Code: REDACTED FOR PRIVACY|Admin Country: REDACTED FOR PRIVACY|Admin Phone: REDACTED FOR PRIVACY|Admin Phone Ext:|Admin Fax: REDACTED FOR PRIVACY|Admin Fax Ext:|Admin Email: f49d30ced9c22a9be906074be2f244a1-32532210@contact.gandi.net|Registry Tech ID: REDACTED FOR PRIVACY|Tech Name: REDACTED FOR PRIVACY|Tech Organization: REDACTED FOR PRIVACY|Tech Street: REDACTED FOR PRIVACY|Tech City: REDACTED FOR PRIVACY|Tech State/Province: REDACTED FOR PRIVACY|Tech Postal Code: REDACTED FOR PRIVACY|Tech Country: REDACTED FOR PRIVACY|Tech Phone: REDACTED FOR PRIVACY|Tech Phone Ext:|Tech Fax: REDACTED FOR PRIVACY|Tech Fax Ext:|Tech Email: aef748ca80d4a4f8a8dccac87a28b122-32532216@contact.gandi.net|Name Server: NS-2-A.GANDI.NET|Name Server: NS-108-B.GANDI.NET|Name Server: NS-102-C.GANDI.NET|Name Server: |Name Server: |Name Server: |Name Server: |Name Server: |Name Server: |Name Server: |DNSSEC: Unsigned|URL of the ICANN WHOIS Data Problem Reporting System: http://wdprs.internic.net/|>>> Last update of WHOIS database: 2021-12-09T11:20:46Z <<<||For more information on Whois status codes, please visit|https://www.icann.org/epp||Reseller Email: |Reseller URL: ||Personal data access and use are governed by French law, any use for the purpose of unsolicited mass commercial advertising as well as any mass or automated inquiries (for any intent other than the registration or modification of a domain name) are strictly forbidden. Copy of whole or part of our database without Gandi's endorsement is strictly forbidden.|A dispute over the ownership of a domain name may be subject to the alternate procedure established by the Registry in question or brought before the courts.|For additional information, please contact us via the following form:| https://www.gandi.net/support/contacter/mail/",
			"registrantContact": {
				"name": "REDACTED FOR PRIVACY",
				"organization": "",
				"street": "REDACTED FOR PRIVACY",
				"city": "REDACTED FOR PRIVACY",
				"state": "Bretagne",
				"postalCode": "REDACTED FOR PRIVACY",
				"country": "FRANCE",
				"email": "69fc5adc7734bf7419dc6d1d3b7d4914-32532282@contact.gandi.net",
				"telephone": "",
				"telephoneExt": "",
				"fax": "",
				"faxExt": "",
				"rawText": "Registrant Name: REDACTED FOR PRIVACY|Registrant Street: REDACTED FOR PRIVACY|Registrant City: REDACTED FOR PRIVACY|Registrant State/Province: Bretagne|Registrant Postal Code: REDACTED FOR PRIVACY|Registrant Country: FR|Registrant Phone: REDACTED FOR PRIVACY|Registrant Fax: REDACTED FOR PRIVACY|Registrant Email: 69fc5adc7734bf7419dc6d1d3b7d4914-32532282@contact.gandi.net"
			},
			"administrativeContact": {
				"name": "REDACTED FOR PRIVACY",
				"organization": "REDACTED FOR PRIVACY",
				"street": "REDACTED FOR PRIVACY",
				"city": "REDACTED FOR PRIVACY",
				"state": "REDACTED FOR PRIVACY",
				"postalCode": "REDACTED FOR PRIVACY",
				"country": "REDACTED FOR PRIVACY",
				"email": "f49d30ced9c22a9be906074be2f244a1-32532210@contact.gandi.net",
				"telephone": "",
				"telephoneExt": "",
				"fax": "",
				"faxExt": "",
				"rawText": "Admin Name: REDACTED FOR PRIVACY|Admin Organization: REDACTED FOR PRIVACY|Admin Street: REDACTED FOR PRIVACY|Admin City: REDACTED FOR PRIVACY|Admin State/Province: REDACTED FOR PRIVACY|Admin Postal Code: REDACTED FOR PRIVACY|Admin Country: REDACTED FOR PRIVACY|Admin Phone: REDACTED FOR PRIVACY|Admin Fax: REDACTED FOR PRIVACY|Admin Email: f49d30ced9c22a9be906074be2f244a1-32532210@contact.gandi.net"
			},
			"technicalContact": {
				"name": "REDACTED FOR PRIVACY",
				"organization": "REDACTED FOR PRIVACY",
				"street": "REDACTED FOR PRIVACY",
				"city": "REDACTED FOR PRIVACY",
				"state": "REDACTED FOR PRIVACY",
				"postalCode": "REDACTED FOR PRIVACY",
				"country": "REDACTED FOR PRIVACY",
				"email": "aef748ca80d4a4f8a8dccac87a28b122-32532216@contact.gandi.net",
				"telephone": "",
				"telephoneExt": "",
				"fax": "",
				"faxExt": "",
				"rawText": "Tech Name: REDACTED FOR PRIVACY|Tech Organization: REDACTED FOR PRIVACY|Tech Street: REDACTED FOR PRIVACY|Tech City: REDACTED FOR PRIVACY|Tech State/Province: REDACTED FOR PRIVACY|Tech Postal Code: REDACTED FOR PRIVACY|Tech Country: REDACTED FOR PRIVACY|Tech Phone: REDACTED FOR PRIVACY|Tech Fax: REDACTED FOR PRIVACY|Tech Email: aef748ca80d4a4f8a8dccac87a28b122-32532216@contact.gandi.net"
			},
			"billingContact": {
				"name": "",
				"organization": "",
				"street": "",
				"city": "",
				"state": "",
				"postalCode": "",
				"country": "",
				"email": "",
				"telephone": "",
				"telephoneExt": "",
				"fax": "",
				"faxExt": "",
				"rawText": ""
			},
			"zoneContact": {
				"name": "",
				"organization": "",
				"street": "",
				"city": "",
				"state": "",
				"postalCode": "",
				"country": "",
				"email": "",
				"telephone": "",
				"telephoneExt": "",
				"fax": "",
				"faxExt": "",
				"rawText": ""
			}
		},
		{
			"domainName": "psychedelik.com",
			"domainType": "added",
			"createdDateISO8601": "2002-06-14T09:56:54+00:00",
			"updatedDateISO8601": "2021-12-08T09:38:23+00:00",
			"expiresDateISO8601": "2023-06-14T09:56:54+00:00",
			"createdDateRaw": "2002-06-14T09:56:54Z",
			"updatedDateRaw": "2021-12-08T09:38:23Z",
			"expiresDateRaw": "2023-06-14T09:56:54Z",
			"audit": {
				"createdDate": "2021-12-09T07:13:41+00:00",
				"updatedDate": "2021-12-09T07:13:41+00:00"
			},
			"nameServers": [
				"NS-2-A.GANDI.NET",
				"NS-108-B.GANDI.NET",
				"NS-102-C.GANDI.NET"
			],
			"whoisServer": "whois.gandi.net",
			"registrarName": "GANDI SAS",
			"status": [
				"clientTransferProhibited"
			],
			"cleanText": "Domain Name: psychedelik.com\nRegistrar WHOIS Server: whois.gandi.net\nRegistrar URL: http://www.gandi.net\nUpdated Date: 2021-12-08T09:38:23Z\nCreation Date: 2002-06-14T09:56:54Z\nRegistrar Registration Expiration Date: 2023-06-14T09:56:54Z\nRegistrar: GANDI SAS\nRegistrar IANA ID: 81\nRegistrar Abuse Contact Email: abuse@support.gandi.net\nRegistrar Abuse Contact Phone: +33.170377661\nDomain Status: clientTransferProhibited http://www.icann.org/epp#clientTransferProhibited\nRegistrant Name: REDACTED FOR PRIVACY\nRegistrant Street: REDACTED FOR PRIVACY\nRegistrant City: REDACTED FOR PRIVACY\nRegistrant State/Province: Bretagne\nRegistrant Postal Code: REDACTED FOR PRIVACY\nRegistrant Country: FR\nRegistrant Phone: REDACTED FOR PRIVACY\nRegistrant Fax: REDACTED FOR PRIVACY\nRegistrant Email: 69fc5adc7734bf7419dc6d1d3b7d4914-32532282@contact.gandi.net\nAdmin Name: REDACTED FOR PRIVACY\nAdmin Organization: REDACTED FOR PRIVACY\nAdmin Street: REDACTED FOR PRIVACY\nAdmin City: REDACTED FOR PRIVACY\nAdmin State/Province: REDACTED FOR PRIVACY\nAdmin Postal Code: REDACTED FOR PRIVACY\nAdmin Country: REDACTED FOR PRIVACY\nAdmin Phone: REDACTED FOR PRIVACY\nAdmin Fax: REDACTED FOR PRIVACY\nAdmin Email: f49d30ced9c22a9be906074be2f244a1-32532210@contact.gandi.net\nTech Name: REDACTED FOR PRIVACY\nTech Organization: REDACTED FOR PRIVACY\nTech Street: REDACTED FOR PRIVACY\nTech City: REDACTED FOR PRIVACY\nTech State/Province: REDACTED FOR PRIVACY\nTech Postal Code: REDACTED FOR PRIVACY\nTech Country: REDACTED FOR PRIVACY\nTech Phone: REDACTED FOR PRIVACY\nTech Fax: REDACTED FOR PRIVACY\nTech Email: aef748ca80d4a4f8a8dccac87a28b122-32532216@contact.gandi.net\nName Server: NS-2-A.GANDI.NET\nName Server: NS-108-B.GANDI.NET\nName Server: NS-102-C.GANDI.NET\n",
			"rawText": "Domain Name: psychedelik.com\nRegistry Domain ID: 87535220_DOMAIN_COM-VRSN\nRegistrar WHOIS Server: whois.gandi.net\nRegistrar URL: http://www.gandi.net\nUpdated Date: 2021-12-08T09:38:23Z\nCreation Date: 2002-06-14T09:56:54Z\nRegistrar Registration Expiration Date: 2023-06-14T09:56:54Z\nRegistrar: GANDI SAS\nRegistrar IANA ID: 81\nRegistrar Abuse Contact Email: abuse@support.gandi.net\nRegistrar Abuse Contact Phone: +33.170377661\nReseller: \nDomain Status: clientTransferProhibited http://www.icann.org/epp#clientTransferProhibited\nDomain Status: \nDomain Status: \nDomain Status: \nDomain Status: \nRegistry Registrant ID: REDACTED FOR PRIVACY\nRegistrant Name: REDACTED FOR PRIVACY\nRegistrant Organization: \nRegistrant Street: REDACTED FOR PRIVACY\nRegistrant City: REDACTED FOR PRIVACY\nRegistrant State/Province: Bretagne\nRegistrant Postal Code: REDACTED FOR PRIVACY\nRegistrant Country: FR\nRegistrant Phone: REDACTED FOR PRIVACY\nRegistrant Phone Ext:\nRegistrant Fax: REDACTED FOR PRIVACY\nRegistrant Fax Ext:\nRegistrant Email: 69fc5adc7734bf7419dc6d1d3b7d4914-32532282@contact.gandi.net\nRegistry Admin ID: REDACTED FOR PRIVACY\nAdmin Name: REDACTED FOR PRIVACY\nAdmin Organization: REDACTED FOR PRIVACY\nAdmin Street: REDACTED FOR PRIVACY\nAdmin City: REDACTED FOR PRIVACY\nAdmin State/Province: REDACTED FOR PRIVACY\nAdmin Postal Code: REDACTED FOR PRIVACY\nAdmin Country: REDACTED FOR PRIVACY\nAdmin Phone: REDACTED FOR PRIVACY\nAdmin Phone Ext:\nAdmin Fax: REDACTED FOR PRIVACY\nAdmin Fax Ext:\nAdmin Email: f49d30ced9c22a9be906074be2f244a1-32532210@contact.gandi.net\nRegistry Tech ID: REDACTED FOR PRIVACY\nTech Name: REDACTED FOR PRIVACY\nTech Organization: REDACTED FOR PRIVACY\nTech Street: REDACTED FOR PRIVACY\nTech City: REDACTED FOR PRIVACY\nTech State/Province: REDACTED FOR PRIVACY\nTech Postal Code: REDACTED FOR PRIVACY\nTech Country: REDACTED FOR PRIVACY\nTech Phone: REDACTED FOR PRIVACY\nTech Phone Ext:\nTech Fax: REDACTED FOR PRIVACY\nTech Fax Ext:\nTech Email: aef748ca80d4a4f8a8dccac87a28b122-32532216@contact.gandi.net\nName Server: NS-2-A.GANDI.NET\nName Server: NS-108-B.GANDI.NET\nName Server: NS-102-C.GANDI.NET\nName Server: \nName Server: \nName Server: \nName Server: \nName Server: \nName Server: \nName Server: \nDNSSEC: Unsigned\nURL of the ICANN WHOIS Data Problem Reporting System: http://wdprs.internic.net/\n>>> Last update of WHOIS database: 2021-12-09T07:13:37Z <<<\n\nFor more information on Whois status codes, please visit\nhttps://www.icann.org/epp\n\nReseller Email: \nReseller URL: \n\nPersonal data access and use are governed by French law, any use for the purpose of unsolicited mass commercial advertising as well as any mass or automated inquiries (for any intent other than the registration or modification of a domain name) are strictly forbidden. Copy of whole or part of our database without Gandi's endorsement is strictly forbidden.\nA dispute over the ownership of a domain name may be subject to the alternate procedure established by the Registry in question or brought before the courts.\nFor additional information, please contact us via the following form:\n https://www.gandi.net/support/contacter/mail/",
			"registrantContact": {
				"name": "REDACTED FOR PRIVACY",
				"organization": null,
				"street": "REDACTED FOR PRIVACY",
				"city": "REDACTED FOR PRIVACY",
				"state": "Bretagne",
				"postalCode": "REDACTED FOR PRIVACY",
				"country": "FRANCE",
				"email": "69fc5adc7734bf7419dc6d1d3b7d4914-32532282@contact.gandi.net",
				"telephone": "",
				"telephoneExt": null,
				"fax": "",
				"faxExt": null,
				"rawText": "Registrant Name: REDACTED FOR PRIVACY\nRegistrant Street: REDACTED FOR PRIVACY\nRegistrant City: REDACTED FOR PRIVACY\nRegistrant State/Province: Bretagne\nRegistrant Postal Code: REDACTED FOR PRIVACY\nRegistrant Country: FR\nRegistrant Phone: REDACTED FOR PRIVACY\nRegistrant Fax: REDACTED FOR PRIVACY\nRegistrant Email: 69fc5adc7734bf7419dc6d1d3b7d4914-32532282@contact.gandi.net"
			},
			"administrativeContact": {
				"name": "REDACTED FOR PRIVACY",
				"organization": "REDACTED FOR PRIVACY",
				"street": "REDACTED FOR PRIVACY",
				"city": "REDACTED FOR PRIVACY",
				"state": "REDACTED FOR PRIVACY",
				"postalCode": "REDACTED FOR PRIVACY",
				"country": "REDACTED FOR PRIVACY",
				"email": "f49d30ced9c22a9be906074be2f244a1-32532210@contact.gandi.net",
				"telephone": "",
				"telephoneExt": null,
				"fax": "",
				"faxExt": null,
				"rawText": "Admin Name: REDACTED FOR PRIVACY\nAdmin Organization: REDACTED FOR PRIVACY\nAdmin Street: REDACTED FOR PRIVACY\nAdmin City: REDACTED FOR PRIVACY\nAdmin State/Province: REDACTED FOR PRIVACY\nAdmin Postal Code: REDACTED FOR PRIVACY\nAdmin Country: REDACTED FOR PRIVACY\nAdmin Phone: REDACTED FOR PRIVACY\nAdmin Fax: REDACTED FOR PRIVACY\nAdmin Email: f49d30ced9c22a9be906074be2f244a1-32532210@contact.gandi.net"
			},
			"technicalContact": {
				"name": "REDACTED FOR PRIVACY",
				"organization": "REDACTED FOR PRIVACY",
				"street": "REDACTED FOR PRIVACY",
				"city": "REDACTED FOR PRIVACY",
				"state": "REDACTED FOR PRIVACY",
				"postalCode": "REDACTED FOR PRIVACY",
				"country": "REDACTED FOR PRIVACY",
				"email": "aef748ca80d4a4f8a8dccac87a28b122-32532216@contact.gandi.net",
				"telephone": "",
				"telephoneExt": null,
				"fax": "",
				"faxExt": null,
				"rawText": "Tech Name: REDACTED FOR PRIVACY\nTech Organization: REDACTED FOR PRIVACY\nTech Street: REDACTED FOR PRIVACY\nTech City: REDACTED FOR PRIVACY\nTech State/Province: REDACTED FOR PRIVACY\nTech Postal Code: REDACTED FOR PRIVACY\nTech Country: REDACTED FOR PRIVACY\nTech Phone: REDACTED FOR PRIVACY\nTech Fax: REDACTED FOR PRIVACY\nTech Email: aef748ca80d4a4f8a8dccac87a28b122-32532216@contact.gandi.net"
			},
			"billingContact": {
				"name": null,
				"organization": null,
				"street": "",
				"city": null,
				"state": null,
				"postalCode": null,
				"country": null,
				"email": null,
				"telephone": null,
				"telephoneExt": null,
				"fax": null,
				"faxExt": null,
				"rawText": null
			},
			"zoneContact": {
				"name": null,
				"organization": null,
				"street": "",
				"city": null,
				"state": null,
				"postalCode": null,
				"country": null,
				"email": null,
				"telephone": null,
				"telephoneExt": null,
				"fax": null,
				"faxExt": null,
				"rawText": null
			}
		},
		{
			"updatedDate": "2021-05-24T12:46:43+00:00",
			"otherWhoisData": "{ omitted in the demo }"
		},
		{
			"updatedDate": "2020-06-06T16:31:17+00:00",
			"otherWhoisData": "{ omitted in the demo }"
		},
		{
			"updatedDate": "2020-06-06T16:31:17+00:00",
			"otherWhoisData": "{ omitted in the demo }"
		},
		{
			"updatedDate": "2019-06-01T14:24:32+00:00",
			"otherWhoisData": "{ omitted in the demo }"
		},
		{
			"updatedDate": "2019-06-01T14:24:32+00:00",
			"otherWhoisData": "{ omitted in the demo }"
		},
		{
			"updatedDate": "2019-06-01T14:24:32+00:00",
			"otherWhoisData": "{ omitted in the demo }"
		},
		{
			"updatedDate": "2019-06-01T14:24:32+00:00",
			"otherWhoisData": "{ omitted in the demo }"
		},
		{
			"updatedDate": "2018-05-17T09:23:16+00:00",
			"otherWhoisData": "{ omitted in the demo }"
		},
		{
			"updatedDate": "2017-06-13T00:54:01+00:00",
			"otherWhoisData": "{ omitted in the demo }"
		},
		{
			"updatedDate": "2017-06-12T22:54:01+00:00",
			"otherWhoisData": "{ omitted in the demo }"
		},
		{
			"updatedDate": "2016-05-20T00:00:00+00:00",
			"otherWhoisData": "{ omitted in the demo }"
		},
		{
			"updatedDate": "2016-05-20T00:00:00+00:00",
			"otherWhoisData": "{ omitted in the demo }"
		},
		{
			"updatedDate": "2016-04-20T00:00:00+00:00",
			"otherWhoisData": "{ omitted in the demo }"
		},
		{
			"updatedDate": "2014-12-11T00:00:00+00:00",
			"otherWhoisData": "{ omitted in the demo }"
		},
		{
			"updatedDate": "2014-12-11T00:00:00+00:00",
			"otherWhoisData": "{ omitted in the demo }"
		},
		{
			"updatedDate": "2013-11-30T00:00:00+00:00",
			"otherWhoisData": "{ omitted in the demo }"
		},
		{
			"updatedDate": "2013-11-30T00:00:00+00:00",
			"otherWhoisData": "{ omitted in the demo }"
		},
		{
			"updatedDate": "2013-11-30T00:00:00+00:00",
			"otherWhoisData": "{ omitted in the demo }"
		},
		{
			"updatedDate": "2012-11-30T00:00:00+00:00",
			"otherWhoisData": "{ omitted in the demo }"
		},
		{
			"updatedDate": "2012-11-30T00:00:00+00:00",
			"otherWhoisData": "{ omitted in the demo }"
		},
		{
			"updatedDate": "2012-11-30T00:00:00+00:00",
			"otherWhoisData": "{ omitted in the demo }"
		},
		{
			"updatedDate": "2011-07-03T00:00:00+00:00",
			"otherWhoisData": "{ omitted in the demo }"
		},
		{
			"updatedDate": "2011-07-03T00:00:00+00:00",
			"otherWhoisData": "{ omitted in the demo }"
		},
		{
			"updatedDate": "2011-07-03T00:00:00+00:00",
			"otherWhoisData": "{ omitted in the demo }"
		},
		{
			"updatedDate": "2010-03-08T00:00:00+00:00",
			"otherWhoisData": "{ omitted in the demo }"
		}
	],
	"recordsCount": 28
}